Month ID,Month,State ID,State,HS6 ID,HS6,Flow ID,Flow,Country ID,Country,Trade Value
201901,2019-01,7,Chiapas,6350691,"Polymer or Rubber Based Adhesives (Exc. Conditioned for Retail Sale as Glues or Adhesives, Net Weight <= 1 Kg)",1,Imports,gtm,Guatemala,2223
201901,2019-01,7,Chiapas,7392010,"Plates, Sheets, Sheets and Strips, of Non-Cellular Polymers of Ethylene without Similar Combination with other Materials",1,Imports,gtm,Guatemala,9054
201901,2019-01,7,Chiapas,7392020,"Plastics of Polymers of Propylene, Plates, Sheets, Film, Foil and Strip (Not Self-Adhesive), Non-Cellular and not Reinforced, Laminated, Supported or Similarly Combined with other Materials",1,Imports,gtm,Guatemala,6672
201901,2019-01,7,Chiapas,7392321,"Bags ""Bags"" Bags and Cones, of Polymers of Ethylene",1,Imports,gtm,Guatemala,4246
201901,2019-01,7,Chiapas,7392329,"Bags ""Bags"" Bags and Cones, of Plastics",1,Imports,gtm,Guatemala,178128
201901,2019-01,7,Chiapas,7392690,Plastic Items and Articles of other Materials,1,Imports,gtm,Guatemala,212138
201901,2019-01,7,Chiapas,7392690,Plastic Items and Articles of other Materials,1,Imports,usa,United States,31675
201901,2019-01,7,Chiapas,9441520,"Pallets, Box Pallets and other Load of Wood; Pallet Collars of Wood (Excl. Containers Specially Designed and Equipped for one or more Modes of Transport)",1,Imports,gtm,Guatemala,197943
201901,2019-01,7,Chiapas,10481141,"Paper and Paperboard, Self-Adhesive, Colored or Surface-Decorated or Printed, in Coils ""Rolls"" or Sheets of Square or Rectangular, of any Size (Excl. Articles of Heading 4810)",1,Imports,gtm,Guatemala,2445
201901,2019-01,7,Chiapas,10481820,"Handkerchiefs, Cleansing or Facial Tissues and Towels, of Paper Pulp, Paper, Cellulose Wadding or Webs of Cellulose Fibers",1,Imports,col,Colombia,2849
201901,2019-01,7,Chiapas,10481820,"Handkerchiefs, Cleansing or Facial Tissues and Towels, of Paper Pulp, Paper, Cellulose Wadding or Webs of Cellulose Fibers",1,Imports,slv,El Salvador,5783
201901,2019-01,7,Chiapas,10481910,Boxes Corrugated Paperboard,1,Imports,gtm,Guatemala,312414
201901,2019-01,7,Chiapas,10482110,"Labels of all Kinds, Paper or Paperboard, Printed",1,Imports,gtm,Guatemala,48357
201901,2019-01,7,Chiapas,10482390,"Paper, Cardboard, Cellulose Wadding and Cellulose Fiber Nappa, in Strips or in Rolls of Width <= 36 Cm or in Square or Rectangular Sheets in which there is no Side> 36 Cm, Unfolded",1,Imports,gtm,Guatemala,36314
201901,2019-01,7,Chiapas,10482390,"Paper, Cardboard, Cellulose Wadding and Cellulose Fiber Nappa, in Strips or in Rolls of Width <= 36 Cm or in Square or Rectangular Sheets in which there is no Side> 36 Cm, Unfolded",1,Imports,usa,United States,80
201901,2019-01,7,Chiapas,16853120,Indicator Boards with Built-In Liquid Crystal Devices or Diodes (Exc. those Used in Cars and Roadways),1,Imports,chn,China,8194
201901,2019-01,7,Chiapas,2080310,Fresh or Dried Bananas,2,Exports,gtm,Guatemala,324508
201901,2019-01,7,Chiapas,2080310,Fresh or Dried Bananas,2,Exports,usa,United States,41227
201901,2019-01,7,Chiapas,2080390,Fresh or Dried Bananas (Banana Excl.),2,Exports,usa,United States,8899268
201901,2019-01,7,Chiapas,2090111,Unroasted Non-Decaffeinated Coffee,2,Exports,deu,Germany,47502
201901,2019-01,7,Chiapas,2090111,Unroasted Non-Decaffeinated Coffee,2,Exports,usa,United States,236531
