Month ID,Month,State ID,State,HS6 ID,HS6,Flow ID,Flow,Country ID,Country,Trade Value
201501,2015-01,7,Chiapas,6350691,"Polymer or Rubber Based Adhesives (Exc. Conditioned for Retail Sale as Glues or Adhesives, Net Weight <= 1 Kg)",1,Imports,gtm,Guatemala,3559
201501,2015-01,7,Chiapas,7391910,"Sheets, Tapes and Others, Self-Adhesive, Plastic, in Width Rolls <= 20 Cm",1,Imports,cri,Costa Rica,216
201501,2015-01,7,Chiapas,7391910,"Sheets, Tapes and Others, Self-Adhesive, Plastic, in Width Rolls <= 20 Cm",1,Imports,gtm,Guatemala,962
201501,2015-01,7,Chiapas,7392329,"Bags ""Bags"" Bags and Cones, of Plastics",1,Imports,gtm,Guatemala,116062
201501,2015-01,7,Chiapas,7392329,"Bags ""Bags"" Bags and Cones, of Plastics",1,Imports,kor,South Korea,197291
201501,2015-01,7,Chiapas,7392690,Plastic Items and Articles of other Materials,1,Imports,usa,United States,36689
201501,2015-01,7,Chiapas,9441520,"Pallets, Box Pallets and other Load of Wood; Pallet Collars of Wood (Excl. Containers Specially Designed and Equipped for one or more Modes of Transport)",1,Imports,gtm,Guatemala,151442
201501,2015-01,7,Chiapas,10480525,"Testliner, Recycled Uncoated in Coils ""Rolls"" Width> 36 Cm or in Sheets of Square or Rectangular with one Side> 36 Cm and the Other> 15 Cm in the Unfolded, Weight> 150 G / M²",1,Imports,gtm,Guatemala,10674
201501,2015-01,7,Chiapas,10481820,"Handkerchiefs, Cleansing or Facial Tissues and Towels, of Paper Pulp, Paper, Cellulose Wadding or Webs of Cellulose Fibers",1,Imports,col,Colombia,1536
201501,2015-01,7,Chiapas,10481820,"Handkerchiefs, Cleansing or Facial Tissues and Towels, of Paper Pulp, Paper, Cellulose Wadding or Webs of Cellulose Fibers",1,Imports,slv,El Salvador,6072
201501,2015-01,7,Chiapas,10481910,Boxes Corrugated Paperboard,1,Imports,gtm,Guatemala,396135
201501,2015-01,7,Chiapas,10482110,"Labels of all Kinds, Paper or Paperboard, Printed",1,Imports,gtm,Guatemala,42878
201501,2015-01,7,Chiapas,10482190,"Labels of all Kinds, Paper or Cardboard, Unprinted",1,Imports,gtm,Guatemala,12
201501,2015-01,7,Chiapas,10482390,"Paper, Cardboard, Cellulose Wadding and Cellulose Fiber Nappa, in Strips or in Rolls of Width <= 36 Cm or in Square or Rectangular Sheets in which there is no Side> 36 Cm, Unfolded",1,Imports,gtm,Guatemala,57301
201501,2015-01,7,Chiapas,2080390,Fresh or Dried Bananas (Banana Excl.),2,Exports,usa,United States,5868524
