Month ID,Month,State ID,State,HS6 ID,HS6,Flow ID,Flow,Country ID,Country,Trade Value
201611,2016-11,7,Chiapas,6350691,"Polymer or Rubber Based Adhesives (Exc. Conditioned for Retail Sale as Glues or Adhesives, Net Weight <= 1 Kg)",1,Imports,gtm,Guatemala,2614
201611,2016-11,7,Chiapas,7392010,"Plates, Sheets, Sheets and Strips, of Non-Cellular Polymers of Ethylene without Similar Combination with other Materials",1,Imports,gtm,Guatemala,13277
201611,2016-11,7,Chiapas,7392020,"Plastics of Polymers of Propylene, Plates, Sheets, Film, Foil and Strip (Not Self-Adhesive), Non-Cellular and not Reinforced, Laminated, Supported or Similarly Combined with other Materials",1,Imports,gtm,Guatemala,11001
201611,2016-11,7,Chiapas,7392329,"Bags ""Bags"" Bags and Cones, of Plastics",1,Imports,gtm,Guatemala,81226
201611,2016-11,7,Chiapas,7392329,"Bags ""Bags"" Bags and Cones, of Plastics",1,Imports,kor,South Korea,126080
201611,2016-11,7,Chiapas,7392329,"Bags ""Bags"" Bags and Cones, of Plastics",1,Imports,nld,Netherlands,4170
201611,2016-11,7,Chiapas,7392690,Plastic Items and Articles of other Materials,1,Imports,chn,China,117
201611,2016-11,7,Chiapas,7392690,Plastic Items and Articles of other Materials,1,Imports,gtm,Guatemala,172119
201611,2016-11,7,Chiapas,7392690,Plastic Items and Articles of other Materials,1,Imports,nld,Netherlands,15236
201611,2016-11,7,Chiapas,7392690,Plastic Items and Articles of other Materials,1,Imports,usa,United States,22578
201611,2016-11,7,Chiapas,9441520,"Pallets, Box Pallets and other Load of Wood; Pallet Collars of Wood (Excl. Containers Specially Designed and Equipped for one or more Modes of Transport)",1,Imports,gtm,Guatemala,104404
201611,2016-11,7,Chiapas,10480525,"Testliner, Recycled Uncoated in Coils ""Rolls"" Width> 36 Cm or in Sheets of Square or Rectangular with one Side> 36 Cm and the Other> 15 Cm in the Unfolded, Weight> 150 G / M²",1,Imports,gtm,Guatemala,9953
201611,2016-11,7,Chiapas,10480810,Corrugated Paper and Paperboard,1,Imports,gtm,Guatemala,740
201611,2016-11,7,Chiapas,10481820,"Handkerchiefs, Cleansing or Facial Tissues and Towels, of Paper Pulp, Paper, Cellulose Wadding or Webs of Cellulose Fibers",1,Imports,col,Colombia,290
201611,2016-11,7,Chiapas,10481820,"Handkerchiefs, Cleansing or Facial Tissues and Towels, of Paper Pulp, Paper, Cellulose Wadding or Webs of Cellulose Fibers",1,Imports,slv,El Salvador,6059
201611,2016-11,7,Chiapas,10481910,Boxes Corrugated Paperboard,1,Imports,gtm,Guatemala,267950
201611,2016-11,7,Chiapas,10482110,"Labels of all Kinds, Paper or Paperboard, Printed",1,Imports,gtm,Guatemala,63294
201611,2016-11,7,Chiapas,10482390,"Paper, Cardboard, Cellulose Wadding and Cellulose Fiber Nappa, in Strips or in Rolls of Width <= 36 Cm or in Square or Rectangular Sheets in which there is no Side> 36 Cm, Unfolded",1,Imports,dom,Dominican Republic,40
201611,2016-11,7,Chiapas,10482390,"Paper, Cardboard, Cellulose Wadding and Cellulose Fiber Nappa, in Strips or in Rolls of Width <= 36 Cm or in Square or Rectangular Sheets in which there is no Side> 36 Cm, Unfolded",1,Imports,gtm,Guatemala,31675
201611,2016-11,7,Chiapas,10482390,"Paper, Cardboard, Cellulose Wadding and Cellulose Fiber Nappa, in Strips or in Rolls of Width <= 36 Cm or in Square or Rectangular Sheets in which there is no Side> 36 Cm, Unfolded",1,Imports,usa,United States,1215
201611,2016-11,7,Chiapas,2080390,Fresh or Dried Bananas (Banana Excl.),2,Exports,usa,United States,7543775
