Month ID,Month,State ID,State,HS6 ID,HS6,Flow ID,Flow,Country ID,Country,Trade Value
202506,2025-06,7,Chiapas,1030617,"Frozen, Shrimps and Prawns, Excluding Cold-Water Varieties, in Shell or Not, Smoked, Cooked or not before or during Smoking",1,Imports,gtm,Guatemala,1822300
202506,2025-06,7,Chiapas,1030617,"Frozen, Shrimps and Prawns, Excluding Cold-Water Varieties, in Shell or Not, Smoked, Cooked or not before or during Smoking",1,Imports,hnd,Honduras,6417425
202506,2025-06,7,Chiapas,1030617,"Frozen, Shrimps and Prawns, Excluding Cold-Water Varieties, in Shell or Not, Smoked, Cooked or not before or during Smoking",1,Imports,nic,Nicaragua,1046350
202506,2025-06,7,Chiapas,3151190,"Palm Oil and its Fractions, Incl. Refined, not Chemically Modified (Excl. Crude Palm Oil)",1,Imports,gtm,Guatemala,304773
202506,2025-06,7,Chiapas,4210390,"Preparations for Prepared Sauces and Sauces; Condiments and Seasonings (Exc. Soy Sauce, Tomato Sauces, Mustard Flour and Prepared Mustard)",1,Imports,chn,China,8469
202506,2025-06,7,Chiapas,4210390,"Preparations for Prepared Sauces and Sauces; Condiments and Seasonings (Exc. Soy Sauce, Tomato Sauces, Mustard Flour and Prepared Mustard)",1,Imports,cri,Costa Rica,5316
202506,2025-06,7,Chiapas,4210390,"Preparations for Prepared Sauces and Sauces; Condiments and Seasonings (Exc. Soy Sauce, Tomato Sauces, Mustard Flour and Prepared Mustard)",1,Imports,gtm,Guatemala,1949
202506,2025-06,7,Chiapas,6350691,"Polymer or Rubber Based Adhesives (Exc. Conditioned for Retail Sale as Glues or Adhesives, Net Weight <= 1 Kg)",1,Imports,gtm,Guatemala,2103
202506,2025-06,7,Chiapas,7391910,"Sheets, Tapes and Others, Self-Adhesive, Plastic, in Width Rolls <= 20 Cm",1,Imports,chn,China,12283
202506,2025-06,7,Chiapas,7391910,"Sheets, Tapes and Others, Self-Adhesive, Plastic, in Width Rolls <= 20 Cm",1,Imports,gtm,Guatemala,849
202506,2025-06,7,Chiapas,7392010,"Plates, Sheets, Sheets and Strips, of Non-Cellular Polymers of Ethylene without Similar Combination with other Materials",1,Imports,gtm,Guatemala,32326
202506,2025-06,7,Chiapas,7392020,"Plastics of Polymers of Propylene, Plates, Sheets, Film, Foil and Strip (Not Self-Adhesive), Non-Cellular and not Reinforced, Laminated, Supported or Similarly Combined with other Materials",1,Imports,gtm,Guatemala,7262
202506,2025-06,7,Chiapas,7392321,"Bags ""Bags"" Bags and Cones, of Polymers of Ethylene",1,Imports,gtm,Guatemala,14699
202506,2025-06,7,Chiapas,7392690,Plastic Items and Articles of other Materials,1,Imports,chn,China,279
202506,2025-06,7,Chiapas,7392690,Plastic Items and Articles of other Materials,1,Imports,gtm,Guatemala,189528
202506,2025-06,7,Chiapas,7392690,Plastic Items and Articles of other Materials,1,Imports,usa,United States,40961
202506,2025-06,7,Chiapas,7401693,"Gaskets, of Vulcanised Rubber (Exc. Cellular Rubber)",1,Imports,chn,China,21
202506,2025-06,7,Chiapas,7401693,"Gaskets, of Vulcanised Rubber (Exc. Cellular Rubber)",1,Imports,usa,United States,2254
202506,2025-06,7,Chiapas,9441520,"Pallets, Box Pallets and other Load of Wood; Pallet Collars of Wood (Excl. Containers Specially Designed and Equipped for one or more Modes of Transport)",1,Imports,gtm,Guatemala,147200
202506,2025-06,7,Chiapas,10480525,"Testliner, Recycled Uncoated in Coils ""Rolls"" Width> 36 Cm or in Sheets of Square or Rectangular with one Side> 36 Cm and the Other> 15 Cm in the Unfolded, Weight> 150 G / M²",1,Imports,gtm,Guatemala,49253
202506,2025-06,7,Chiapas,10481910,Boxes Corrugated Paperboard,1,Imports,gtm,Guatemala,850692
202506,2025-06,7,Chiapas,10482110,"Labels of all Kinds, Paper or Paperboard, Printed",1,Imports,gtm,Guatemala,109833
202506,2025-06,7,Chiapas,2080310,Fresh or Dried Bananas,2,Exports,gtm,Guatemala,185328
202506,2025-06,7,Chiapas,2080310,Fresh or Dried Bananas,2,Exports,usa,United States,212453
202506,2025-06,7,Chiapas,2080390,Fresh or Dried Bananas (Banana Excl.),2,Exports,usa,United States,7885894
202506,2025-06,7,Chiapas,2080450,"Guava, Mangoes and Mangosteens, Fresh or Dried",2,Exports,usa,United States,243618
202506,2025-06,7,Chiapas,2081090,"Fresh Tamarinds, Cashews, Jackfruit, Lychees, Sapodilla Plums, Passion Fruit, Carambola, Pitahaya and other Edible Fruits (Excl. Nuts, Bananas, Dates, Figs, Pineapples, Avocados, Guavas, Mangoes and Mangosteens, Papayas ""Papayas"" Citrus Fruits, Grapes, Melons, Apples, Quinces, Pears, Apricots, Cherries, Peaches, Plums, Sloes, Strawberries, Raspberries, Blueberries, Blackberries, Loganberries, Cranberries, Fruits of the Genus Vaccinium, Kiwi, Durians, Khaki, Black , White and Redcurrants and Gooseberries)",2,Exports,usa,United States,397587
202506,2025-06,7,Chiapas,2090111,Unroasted Non-Decaffeinated Coffee,2,Exports,aut,Austria,207927
202506,2025-06,7,Chiapas,2090111,Unroasted Non-Decaffeinated Coffee,2,Exports,bel,Belgium,463620
202506,2025-06,7,Chiapas,2090111,Unroasted Non-Decaffeinated Coffee,2,Exports,can,Canada,154540
202506,2025-06,7,Chiapas,2090111,Unroasted Non-Decaffeinated Coffee,2,Exports,deu,Germany,809228
202506,2025-06,7,Chiapas,2090111,Unroasted Non-Decaffeinated Coffee,2,Exports,esp,Spain,187696
202506,2025-06,7,Chiapas,2090111,Unroasted Non-Decaffeinated Coffee,2,Exports,irl,Ireland,154540
202506,2025-06,7,Chiapas,2090111,Unroasted Non-Decaffeinated Coffee,2,Exports,nld,Netherlands,123632
202506,2025-06,7,Chiapas,2090111,Unroasted Non-Decaffeinated Coffee,2,Exports,usa,United States,3186333
