Month ID,Month,State ID,State,HS6 ID,HS6,Flow ID,Flow,Country ID,Country,Trade Value
201709,2017-09,33,No Informado,2070960,"Fruits of the Genus Capsicum or of the Genus Pimenta, Fresh or Chilled",2,Exports,usa,United States,1502241
201709,2017-09,33,No Informado,7392310,"Boxes, Crates and Similar Articles. for Conveyance or Packing; Plastic",2,Exports,usa,United States,276
201709,2017-09,33,No Informado,7392690,Plastic Items and Articles of other Materials,2,Exports,fra,France,6
201709,2017-09,33,No Informado,7392690,Plastic Items and Articles of other Materials,2,Exports,hnd,Honduras,3088
201709,2017-09,33,No Informado,7392690,Plastic Items and Articles of other Materials,2,Exports,slv,El Salvador,2910
201709,2017-09,33,No Informado,7392690,Plastic Items and Articles of other Materials,2,Exports,usa,United States,6644
201709,2017-09,33,No Informado,15732690,Articles of Iron or Steel,2,Exports,usa,United States,30081
201709,2017-09,33,No Informado,17870829,Parts and Accessories of Vehicles Bodies,2,Exports,usa,United States,62374
