Month ID,Month,State ID,State,HS6 ID,HS6,Flow ID,Flow,Country ID,Country,Trade Value
202011,2020-11,7,Chiapas,6350691,"Polymer or Rubber Based Adhesives (Exc. Conditioned for Retail Sale as Glues or Adhesives, Net Weight <= 1 Kg)",1,Imports,gtm,Guatemala,3628
202011,2020-11,7,Chiapas,7392010,"Plates, Sheets, Sheets and Strips, of Non-Cellular Polymers of Ethylene without Similar Combination with other Materials",1,Imports,gtm,Guatemala,37965
202011,2020-11,7,Chiapas,7392020,"Plastics of Polymers of Propylene, Plates, Sheets, Film, Foil and Strip (Not Self-Adhesive), Non-Cellular and not Reinforced, Laminated, Supported or Similarly Combined with other Materials",1,Imports,gtm,Guatemala,8571
202011,2020-11,7,Chiapas,7392690,Plastic Items and Articles of other Materials,1,Imports,gtm,Guatemala,209137
202011,2020-11,7,Chiapas,7392690,Plastic Items and Articles of other Materials,1,Imports,usa,United States,24243
202011,2020-11,7,Chiapas,9441520,"Pallets, Box Pallets and other Load of Wood; Pallet Collars of Wood (Excl. Containers Specially Designed and Equipped for one or more Modes of Transport)",1,Imports,gtm,Guatemala,172800
202011,2020-11,7,Chiapas,10481820,"Handkerchiefs, Cleansing or Facial Tissues and Towels, of Paper Pulp, Paper, Cellulose Wadding or Webs of Cellulose Fibers",1,Imports,slv,El Salvador,2231
202011,2020-11,7,Chiapas,10481820,"Handkerchiefs, Cleansing or Facial Tissues and Towels, of Paper Pulp, Paper, Cellulose Wadding or Webs of Cellulose Fibers",1,Imports,usa,United States,3784
202011,2020-11,7,Chiapas,10481910,Boxes Corrugated Paperboard,1,Imports,gtm,Guatemala,45788
202011,2020-11,7,Chiapas,10482110,"Labels of all Kinds, Paper or Paperboard, Printed",1,Imports,gtm,Guatemala,54058
202011,2020-11,7,Chiapas,10482390,"Paper, Cardboard, Cellulose Wadding and Cellulose Fiber Nappa, in Strips or in Rolls of Width <= 36 Cm or in Square or Rectangular Sheets in which there is no Side> 36 Cm, Unfolded",1,Imports,gtm,Guatemala,570
202011,2020-11,7,Chiapas,10482390,"Paper, Cardboard, Cellulose Wadding and Cellulose Fiber Nappa, in Strips or in Rolls of Width <= 36 Cm or in Square or Rectangular Sheets in which there is no Side> 36 Cm, Unfolded",1,Imports,hnd,Honduras,68
202011,2020-11,7,Chiapas,10482390,"Paper, Cardboard, Cellulose Wadding and Cellulose Fiber Nappa, in Strips or in Rolls of Width <= 36 Cm or in Square or Rectangular Sheets in which there is no Side> 36 Cm, Unfolded",1,Imports,usa,United States,88
202011,2020-11,7,Chiapas,2080310,Fresh or Dried Bananas,2,Exports,gtm,Guatemala,219754
202011,2020-11,7,Chiapas,2080310,Fresh or Dried Bananas,2,Exports,usa,United States,155592
202011,2020-11,7,Chiapas,2080390,Fresh or Dried Bananas (Banana Excl.),2,Exports,jpn,Japan,191148
202011,2020-11,7,Chiapas,2080390,Fresh or Dried Bananas (Banana Excl.),2,Exports,usa,United States,8038486
