Month ID,Month,State ID,State,HS6 ID,HS6,Flow ID,Flow,Country ID,Country,Trade Value
201608,2016-08,7,Chiapas,6350691,"Polymer or Rubber Based Adhesives (Exc. Conditioned for Retail Sale as Glues or Adhesives, Net Weight <= 1 Kg)",1,Imports,gtm,Guatemala,1846
201608,2016-08,7,Chiapas,7392010,"Plates, Sheets, Sheets and Strips, of Non-Cellular Polymers of Ethylene without Similar Combination with other Materials",1,Imports,gtm,Guatemala,14461
201608,2016-08,7,Chiapas,7392020,"Plastics of Polymers of Propylene, Plates, Sheets, Film, Foil and Strip (Not Self-Adhesive), Non-Cellular and not Reinforced, Laminated, Supported or Similarly Combined with other Materials",1,Imports,gtm,Guatemala,9115
201608,2016-08,7,Chiapas,7392020,"Plastics of Polymers of Propylene, Plates, Sheets, Film, Foil and Strip (Not Self-Adhesive), Non-Cellular and not Reinforced, Laminated, Supported or Similarly Combined with other Materials",1,Imports,usa,United States,1111
201608,2016-08,7,Chiapas,7392329,"Bags ""Bags"" Bags and Cones, of Plastics",1,Imports,gtm,Guatemala,183353
201608,2016-08,7,Chiapas,7392329,"Bags ""Bags"" Bags and Cones, of Plastics",1,Imports,kor,South Korea,154248
201608,2016-08,7,Chiapas,7392690,Plastic Items and Articles of other Materials,1,Imports,gtm,Guatemala,211676
201608,2016-08,7,Chiapas,7392690,Plastic Items and Articles of other Materials,1,Imports,usa,United States,31199
201608,2016-08,7,Chiapas,9441520,"Pallets, Box Pallets and other Load of Wood; Pallet Collars of Wood (Excl. Containers Specially Designed and Equipped for one or more Modes of Transport)",1,Imports,gtm,Guatemala,164360
201608,2016-08,7,Chiapas,10480810,Corrugated Paper and Paperboard,1,Imports,gtm,Guatemala,1615
201608,2016-08,7,Chiapas,10481141,"Paper and Paperboard, Self-Adhesive, Colored or Surface-Decorated or Printed, in Coils ""Rolls"" or Sheets of Square or Rectangular, of any Size (Excl. Articles of Heading 4810)",1,Imports,gtm,Guatemala,1768
201608,2016-08,7,Chiapas,10481820,"Handkerchiefs, Cleansing or Facial Tissues and Towels, of Paper Pulp, Paper, Cellulose Wadding or Webs of Cellulose Fibers",1,Imports,col,Colombia,2127
201608,2016-08,7,Chiapas,10481820,"Handkerchiefs, Cleansing or Facial Tissues and Towels, of Paper Pulp, Paper, Cellulose Wadding or Webs of Cellulose Fibers",1,Imports,slv,El Salvador,5810
201608,2016-08,7,Chiapas,10481910,Boxes Corrugated Paperboard,1,Imports,gtm,Guatemala,465814
201608,2016-08,7,Chiapas,10482110,"Labels of all Kinds, Paper or Paperboard, Printed",1,Imports,cri,Costa Rica,160
201608,2016-08,7,Chiapas,10482110,"Labels of all Kinds, Paper or Paperboard, Printed",1,Imports,gtm,Guatemala,56796
201608,2016-08,7,Chiapas,10482190,"Labels of all Kinds, Paper or Cardboard, Unprinted",1,Imports,gtm,Guatemala,84
201608,2016-08,7,Chiapas,10482390,"Paper, Cardboard, Cellulose Wadding and Cellulose Fiber Nappa, in Strips or in Rolls of Width <= 36 Cm or in Square or Rectangular Sheets in which there is no Side> 36 Cm, Unfolded",1,Imports,gtm,Guatemala,37620
201608,2016-08,7,Chiapas,10482390,"Paper, Cardboard, Cellulose Wadding and Cellulose Fiber Nappa, in Strips or in Rolls of Width <= 36 Cm or in Square or Rectangular Sheets in which there is no Side> 36 Cm, Unfolded",1,Imports,usa,United States,553
201608,2016-08,7,Chiapas,20961210,"Typewriter Ribbons and Tapes Simil., Inked or otherwise Processed for Printing, Incl. on Spools or in Cartridges",1,Imports,usa,United States,88
201608,2016-08,7,Chiapas,2080310,Fresh or Dried Bananas,2,Exports,gtm,Guatemala,281967
201608,2016-08,7,Chiapas,2080310,Fresh or Dried Bananas,2,Exports,usa,United States,30891
201608,2016-08,7,Chiapas,2080390,Fresh or Dried Bananas (Banana Excl.),2,Exports,usa,United States,9030606
