Month ID,Month,State ID,State,HS6 ID,HS6,Flow ID,Flow,Country ID,Country,Trade Value
201309,2013-09,7,Chiapas,6350691,"Polymer or Rubber Based Adhesives (Exc. Conditioned for Retail Sale as Glues or Adhesives, Net Weight <= 1 Kg)",1,Imports,gtm,Guatemala,3429
201309,2013-09,7,Chiapas,7392020,"Plastics of Polymers of Propylene, Plates, Sheets, Film, Foil and Strip (Not Self-Adhesive), Non-Cellular and not Reinforced, Laminated, Supported or Similarly Combined with other Materials",1,Imports,gtm,Guatemala,8666
201309,2013-09,7,Chiapas,7392020,"Plastics of Polymers of Propylene, Plates, Sheets, Film, Foil and Strip (Not Self-Adhesive), Non-Cellular and not Reinforced, Laminated, Supported or Similarly Combined with other Materials",1,Imports,usa,United States,268
201309,2013-09,7,Chiapas,7392329,"Bags ""Bags"" Bags and Cones, of Plastics",1,Imports,gtm,Guatemala,111651
201309,2013-09,7,Chiapas,7392329,"Bags ""Bags"" Bags and Cones, of Plastics",1,Imports,kor,South Korea,132549
201309,2013-09,7,Chiapas,7392329,"Bags ""Bags"" Bags and Cones, of Plastics",1,Imports,usa,United States,69292
201309,2013-09,7,Chiapas,7392690,Plastic Items and Articles of other Materials,1,Imports,gtm,Guatemala,221705
201309,2013-09,7,Chiapas,7392690,Plastic Items and Articles of other Materials,1,Imports,mys,Malaysia,528
201309,2013-09,7,Chiapas,7392690,Plastic Items and Articles of other Materials,1,Imports,usa,United States,44294
201309,2013-09,7,Chiapas,7401693,"Gaskets, of Vulcanised Rubber (Exc. Cellular Rubber)",1,Imports,ind,India,154
201309,2013-09,7,Chiapas,7401693,"Gaskets, of Vulcanised Rubber (Exc. Cellular Rubber)",1,Imports,usa,United States,226
201309,2013-09,7,Chiapas,9441520,"Pallets, Box Pallets and other Load of Wood; Pallet Collars of Wood (Excl. Containers Specially Designed and Equipped for one or more Modes of Transport)",1,Imports,gtm,Guatemala,159046
201309,2013-09,7,Chiapas,10480525,"Testliner, Recycled Uncoated in Coils ""Rolls"" Width> 36 Cm or in Sheets of Square or Rectangular with one Side> 36 Cm and the Other> 15 Cm in the Unfolded, Weight> 150 G / M²",1,Imports,gtm,Guatemala,19181
201309,2013-09,7,Chiapas,10481820,"Handkerchiefs, Cleansing or Facial Tissues and Towels, of Paper Pulp, Paper, Cellulose Wadding or Webs of Cellulose Fibers",1,Imports,gtm,Guatemala,1562
201309,2013-09,7,Chiapas,10481820,"Handkerchiefs, Cleansing or Facial Tissues and Towels, of Paper Pulp, Paper, Cellulose Wadding or Webs of Cellulose Fibers",1,Imports,slv,El Salvador,11531
201309,2013-09,7,Chiapas,10481910,Boxes Corrugated Paperboard,1,Imports,gtm,Guatemala,607886
201309,2013-09,7,Chiapas,10482110,"Labels of all Kinds, Paper or Paperboard, Printed",1,Imports,col,Colombia,482
201309,2013-09,7,Chiapas,10482110,"Labels of all Kinds, Paper or Paperboard, Printed",1,Imports,gtm,Guatemala,39946
201309,2013-09,7,Chiapas,10482190,"Labels of all Kinds, Paper or Cardboard, Unprinted",1,Imports,gtm,Guatemala,78
201309,2013-09,7,Chiapas,10482370,"Articles of Paper Pulp, Molded or Pressed N.E.C",1,Imports,fra,France,85
201309,2013-09,7,Chiapas,10482370,"Articles of Paper Pulp, Molded or Pressed N.E.C",1,Imports,ind,India,67
201309,2013-09,7,Chiapas,10482370,"Articles of Paper Pulp, Molded or Pressed N.E.C",1,Imports,usa,United States,427
201309,2013-09,7,Chiapas,10482390,"Paper, Cardboard, Cellulose Wadding and Cellulose Fiber Nappa, in Strips or in Rolls of Width <= 36 Cm or in Square or Rectangular Sheets in which there is no Side> 36 Cm, Unfolded",1,Imports,gtm,Guatemala,101413
201309,2013-09,7,Chiapas,10482390,"Paper, Cardboard, Cellulose Wadding and Cellulose Fiber Nappa, in Strips or in Rolls of Width <= 36 Cm or in Square or Rectangular Sheets in which there is no Side> 36 Cm, Unfolded",1,Imports,usa,United States,1566
201309,2013-09,7,Chiapas,11560749,"Cordage, Ropes and Cables, Plaited or Not, Incl. Impregnated, Coated, Covered or Sheathed with Rubber or Plastics, of Polyethylene or Polypropylene (Exc. Stringing Atar O Engavillar)",1,Imports,gtm,Guatemala,113858
201309,2013-09,7,Chiapas,15731700,"Nails, Tacks ""Bedbugs"" Staples, Corrugated or Beveled, and Similar Articles., of Iron or Steel, Incl. with Heads of other Materials (Excl. with Copperhead, as well as Staples in Strips)",1,Imports,gtm,Guatemala,1911
201309,2013-09,7,Chiapas,2080390,Fresh or Dried Bananas (Banana Excl.),2,Exports,usa,United States,9061483
201309,2013-09,7,Chiapas,2090111,Unroasted Non-Decaffeinated Coffee,2,Exports,rus,Russia,58247
201309,2013-09,7,Chiapas,2090111,Unroasted Non-Decaffeinated Coffee,2,Exports,swe,Sweden,508342
201309,2013-09,7,Chiapas,2090111,Unroasted Non-Decaffeinated Coffee,2,Exports,usa,United States,1276147
201309,2013-09,7,Chiapas,7392310,"Boxes, Crates and Similar Articles. for Conveyance or Packing; Plastic",2,Exports,gtm,Guatemala,459
201309,2013-09,7,Chiapas,7392310,"Boxes, Crates and Similar Articles. for Conveyance or Packing; Plastic",2,Exports,usa,United States,3950
201309,2013-09,7,Chiapas,7400129,"Natural Rubber, in Primary Forms or in Sheets or Strips (Exc. Smoked Sheets, Technically Specified Rubbers ""Tsnr"" and Natural Rubber Latex, Incl. Prevulcanized)",2,Exports,gtm,Guatemala,117831
