Month ID,Month,State ID,State,HS6 ID,HS6,Flow ID,Flow,Country ID,Country,Trade Value
201607,2016-07,7,Chiapas,6350691,"Polymer or Rubber Based Adhesives (Exc. Conditioned for Retail Sale as Glues or Adhesives, Net Weight <= 1 Kg)",1,Imports,gtm,Guatemala,7473
201607,2016-07,7,Chiapas,6382490,Chemical Products and Preparations of the Chemical or Allied Industries,1,Imports,gtm,Guatemala,11036
201607,2016-07,7,Chiapas,6382490,Chemical Products and Preparations of the Chemical or Allied Industries,1,Imports,nld,Netherlands,3300
201607,2016-07,7,Chiapas,7391910,"Sheets, Tapes and Others, Self-Adhesive, Plastic, in Width Rolls <= 20 Cm",1,Imports,gtm,Guatemala,1035
201607,2016-07,7,Chiapas,7392010,"Plates, Sheets, Sheets and Strips, of Non-Cellular Polymers of Ethylene without Similar Combination with other Materials",1,Imports,gtm,Guatemala,6552
201607,2016-07,7,Chiapas,7392020,"Plastics of Polymers of Propylene, Plates, Sheets, Film, Foil and Strip (Not Self-Adhesive), Non-Cellular and not Reinforced, Laminated, Supported or Similarly Combined with other Materials",1,Imports,gtm,Guatemala,12050
201607,2016-07,7,Chiapas,7392020,"Plastics of Polymers of Propylene, Plates, Sheets, Film, Foil and Strip (Not Self-Adhesive), Non-Cellular and not Reinforced, Laminated, Supported or Similarly Combined with other Materials",1,Imports,usa,United States,764
201607,2016-07,7,Chiapas,7392329,"Bags ""Bags"" Bags and Cones, of Plastics",1,Imports,gtm,Guatemala,131214
201607,2016-07,7,Chiapas,7392329,"Bags ""Bags"" Bags and Cones, of Plastics",1,Imports,kor,South Korea,31998
201607,2016-07,7,Chiapas,7392329,"Bags ""Bags"" Bags and Cones, of Plastics",1,Imports,nld,Netherlands,5897
201607,2016-07,7,Chiapas,7392690,Plastic Items and Articles of other Materials,1,Imports,gtm,Guatemala,158566
201607,2016-07,7,Chiapas,7392690,Plastic Items and Articles of other Materials,1,Imports,nld,Netherlands,5400
201607,2016-07,7,Chiapas,7392690,Plastic Items and Articles of other Materials,1,Imports,usa,United States,67070
201607,2016-07,7,Chiapas,9441520,"Pallets, Box Pallets and other Load of Wood; Pallet Collars of Wood (Excl. Containers Specially Designed and Equipped for one or more Modes of Transport)",1,Imports,gtm,Guatemala,199489
201607,2016-07,7,Chiapas,10480810,Corrugated Paper and Paperboard,1,Imports,gtm,Guatemala,2035
201607,2016-07,7,Chiapas,10481141,"Paper and Paperboard, Self-Adhesive, Colored or Surface-Decorated or Printed, in Coils ""Rolls"" or Sheets of Square or Rectangular, of any Size (Excl. Articles of Heading 4810)",1,Imports,gtm,Guatemala,1906
201607,2016-07,7,Chiapas,10481820,"Handkerchiefs, Cleansing or Facial Tissues and Towels, of Paper Pulp, Paper, Cellulose Wadding or Webs of Cellulose Fibers",1,Imports,col,Colombia,1160
201607,2016-07,7,Chiapas,10481820,"Handkerchiefs, Cleansing or Facial Tissues and Towels, of Paper Pulp, Paper, Cellulose Wadding or Webs of Cellulose Fibers",1,Imports,slv,El Salvador,12629
201607,2016-07,7,Chiapas,10481910,Boxes Corrugated Paperboard,1,Imports,gtm,Guatemala,448405
201607,2016-07,7,Chiapas,10482110,"Labels of all Kinds, Paper or Paperboard, Printed",1,Imports,gtm,Guatemala,48131
201607,2016-07,7,Chiapas,10482190,"Labels of all Kinds, Paper or Cardboard, Unprinted",1,Imports,gtm,Guatemala,119
201607,2016-07,7,Chiapas,10482390,"Paper, Cardboard, Cellulose Wadding and Cellulose Fiber Nappa, in Strips or in Rolls of Width <= 36 Cm or in Square or Rectangular Sheets in which there is no Side> 36 Cm, Unfolded",1,Imports,dom,Dominican Republic,39
201607,2016-07,7,Chiapas,10482390,"Paper, Cardboard, Cellulose Wadding and Cellulose Fiber Nappa, in Strips or in Rolls of Width <= 36 Cm or in Square or Rectangular Sheets in which there is no Side> 36 Cm, Unfolded",1,Imports,gtm,Guatemala,23282
201607,2016-07,7,Chiapas,10482390,"Paper, Cardboard, Cellulose Wadding and Cellulose Fiber Nappa, in Strips or in Rolls of Width <= 36 Cm or in Square or Rectangular Sheets in which there is no Side> 36 Cm, Unfolded",1,Imports,usa,United States,3638
201607,2016-07,7,Chiapas,16848180,"Taps, Cocks, Valves and Similar Appliances, for Pipes, Boiler Shells or the Like",1,Imports,usa,United States,1100
201607,2016-07,7,Chiapas,2080310,Fresh or Dried Bananas,2,Exports,gtm,Guatemala,155402
201607,2016-07,7,Chiapas,2080310,Fresh or Dried Bananas,2,Exports,usa,United States,37056
201607,2016-07,7,Chiapas,2080390,Fresh or Dried Bananas (Banana Excl.),2,Exports,usa,United States,7591927
201607,2016-07,7,Chiapas,2080450,"Guava, Mangoes and Mangosteens, Fresh or Dried",2,Exports,usa,United States,950729
