Month ID,Month,State ID,State,HS6 ID,HS6,Flow ID,Flow,Country ID,Country,Trade Value
201303,2013-03,7,Chiapas,6350691,"Polymer or Rubber Based Adhesives (Exc. Conditioned for Retail Sale as Glues or Adhesives, Net Weight <= 1 Kg)",1,Imports,gtm,Guatemala,11485
201303,2013-03,7,Chiapas,6382490,Chemical Products and Preparations of the Chemical or Allied Industries,1,Imports,gtm,Guatemala,15422
201303,2013-03,7,Chiapas,6382490,Chemical Products and Preparations of the Chemical or Allied Industries,1,Imports,nld,Netherlands,3520
201303,2013-03,7,Chiapas,6382490,Chemical Products and Preparations of the Chemical or Allied Industries,1,Imports,usa,United States,106970
201303,2013-03,7,Chiapas,7392020,"Plastics of Polymers of Propylene, Plates, Sheets, Film, Foil and Strip (Not Self-Adhesive), Non-Cellular and not Reinforced, Laminated, Supported or Similarly Combined with other Materials",1,Imports,gtm,Guatemala,13646
201303,2013-03,7,Chiapas,7392329,"Bags ""Bags"" Bags and Cones, of Plastics",1,Imports,gtm,Guatemala,160385
201303,2013-03,7,Chiapas,7392329,"Bags ""Bags"" Bags and Cones, of Plastics",1,Imports,kor,South Korea,196218
201303,2013-03,7,Chiapas,7392329,"Bags ""Bags"" Bags and Cones, of Plastics",1,Imports,nld,Netherlands,3190
201303,2013-03,7,Chiapas,7392690,Plastic Items and Articles of other Materials,1,Imports,gtm,Guatemala,80837
201303,2013-03,7,Chiapas,7392690,Plastic Items and Articles of other Materials,1,Imports,nld,Netherlands,6398
201303,2013-03,7,Chiapas,7392690,Plastic Items and Articles of other Materials,1,Imports,usa,United States,60360
201303,2013-03,7,Chiapas,9441520,"Pallets, Box Pallets and other Load of Wood; Pallet Collars of Wood (Excl. Containers Specially Designed and Equipped for one or more Modes of Transport)",1,Imports,gtm,Guatemala,202119
201303,2013-03,7,Chiapas,10481820,"Handkerchiefs, Cleansing or Facial Tissues and Towels, of Paper Pulp, Paper, Cellulose Wadding or Webs of Cellulose Fibers",1,Imports,cri,Costa Rica,5049
201303,2013-03,7,Chiapas,10481820,"Handkerchiefs, Cleansing or Facial Tissues and Towels, of Paper Pulp, Paper, Cellulose Wadding or Webs of Cellulose Fibers",1,Imports,slv,El Salvador,14321
201303,2013-03,7,Chiapas,10481910,Boxes Corrugated Paperboard,1,Imports,gtm,Guatemala,600012
201303,2013-03,7,Chiapas,10482110,"Labels of all Kinds, Paper or Paperboard, Printed",1,Imports,cri,Costa Rica,8702
201303,2013-03,7,Chiapas,10482110,"Labels of all Kinds, Paper or Paperboard, Printed",1,Imports,gtm,Guatemala,64928
201303,2013-03,7,Chiapas,10482190,"Labels of all Kinds, Paper or Cardboard, Unprinted",1,Imports,gtm,Guatemala,146
201303,2013-03,7,Chiapas,10482390,"Paper, Cardboard, Cellulose Wadding and Cellulose Fiber Nappa, in Strips or in Rolls of Width <= 36 Cm or in Square or Rectangular Sheets in which there is no Side> 36 Cm, Unfolded",1,Imports,gtm,Guatemala,45842
201303,2013-03,7,Chiapas,11560749,"Cordage, Ropes and Cables, Plaited or Not, Incl. Impregnated, Coated, Covered or Sheathed with Rubber or Plastics, of Polyethylene or Polypropylene (Exc. Stringing Atar O Engavillar)",1,Imports,gtm,Guatemala,51986
201303,2013-03,7,Chiapas,15731700,"Nails, Tacks ""Bedbugs"" Staples, Corrugated or Beveled, and Similar Articles., of Iron or Steel, Incl. with Heads of other Materials (Excl. with Copperhead, as well as Staples in Strips)",1,Imports,gtm,Guatemala,3333
201303,2013-03,7,Chiapas,2080390,Fresh or Dried Bananas (Banana Excl.),2,Exports,usa,United States,9565269
201303,2013-03,7,Chiapas,2080450,"Guava, Mangoes and Mangosteens, Fresh or Dried",2,Exports,can,Canada,1281340
201303,2013-03,7,Chiapas,2080450,"Guava, Mangoes and Mangosteens, Fresh or Dried",2,Exports,esp,Spain,10811
201303,2013-03,7,Chiapas,2080450,"Guava, Mangoes and Mangosteens, Fresh or Dried",2,Exports,gtm,Guatemala,41
201303,2013-03,7,Chiapas,2080450,"Guava, Mangoes and Mangosteens, Fresh or Dried",2,Exports,usa,United States,2660746
201303,2013-03,7,Chiapas,2090111,Unroasted Non-Decaffeinated Coffee,2,Exports,bel,Belgium,120683
201303,2013-03,7,Chiapas,2090111,Unroasted Non-Decaffeinated Coffee,2,Exports,can,Canada,1959668
201303,2013-03,7,Chiapas,2090111,Unroasted Non-Decaffeinated Coffee,2,Exports,deu,Germany,1293035
201303,2013-03,7,Chiapas,2090111,Unroasted Non-Decaffeinated Coffee,2,Exports,esp,Spain,189645
201303,2013-03,7,Chiapas,2090111,Unroasted Non-Decaffeinated Coffee,2,Exports,ita,Italy,63215
201303,2013-03,7,Chiapas,2090111,Unroasted Non-Decaffeinated Coffee,2,Exports,jpn,Japan,425264
201303,2013-03,7,Chiapas,2090111,Unroasted Non-Decaffeinated Coffee,2,Exports,nzl,New Zealand,142521
201303,2013-03,7,Chiapas,2090111,Unroasted Non-Decaffeinated Coffee,2,Exports,rus,Russia,63215
201303,2013-03,7,Chiapas,2090111,Unroasted Non-Decaffeinated Coffee,2,Exports,usa,United States,8396108
201303,2013-03,7,Chiapas,7400129,"Natural Rubber, in Primary Forms or in Sheets or Strips (Exc. Smoked Sheets, Technically Specified Rubbers ""Tsnr"" and Natural Rubber Latex, Incl. Prevulcanized)",2,Exports,gtm,Guatemala,366527
201303,2013-03,7,Chiapas,10481910,Boxes Corrugated Paperboard,2,Exports,can,Canada,3
201303,2013-03,7,Chiapas,10481910,Boxes Corrugated Paperboard,2,Exports,usa,United States,277
