Month ID,Month,State ID,State,HS6 ID,HS6,Flow ID,Flow,Country ID,Country,Trade Value
202004,2020-04,33,No Informado,1010290,Live Bovine Animals (Except Cattle and Buffalo),2,Exports,usa,United States,128549
202004,2020-04,33,No Informado,2070999,Vegetables Fresh or Chilled Nes,2,Exports,usa,United States,17033
202004,2020-04,33,No Informado,7392690,Plastic Items and Articles of other Materials,2,Exports,gtm,Guatemala,178
202004,2020-04,33,No Informado,7392690,Plastic Items and Articles of other Materials,2,Exports,nic,Nicaragua,161
202004,2020-04,33,No Informado,7392690,Plastic Items and Articles of other Materials,2,Exports,usa,United States,9762
