Month ID,Month,State ID,State,HS6 ID,HS6,Flow ID,Flow,Country ID,Country,Trade Value
201601,2016-01,7,Chiapas,6350691,"Polymer or Rubber Based Adhesives (Exc. Conditioned for Retail Sale as Glues or Adhesives, Net Weight <= 1 Kg)",1,Imports,gtm,Guatemala,7192
201601,2016-01,7,Chiapas,7391910,"Sheets, Tapes and Others, Self-Adhesive, Plastic, in Width Rolls <= 20 Cm",1,Imports,gtm,Guatemala,1015
201601,2016-01,7,Chiapas,7392010,"Plates, Sheets, Sheets and Strips, of Non-Cellular Polymers of Ethylene without Similar Combination with other Materials",1,Imports,gtm,Guatemala,4668
201601,2016-01,7,Chiapas,7392020,"Plastics of Polymers of Propylene, Plates, Sheets, Film, Foil and Strip (Not Self-Adhesive), Non-Cellular and not Reinforced, Laminated, Supported or Similarly Combined with other Materials",1,Imports,gtm,Guatemala,7706
201601,2016-01,7,Chiapas,7392020,"Plastics of Polymers of Propylene, Plates, Sheets, Film, Foil and Strip (Not Self-Adhesive), Non-Cellular and not Reinforced, Laminated, Supported or Similarly Combined with other Materials",1,Imports,usa,United States,764
201601,2016-01,7,Chiapas,7392329,"Bags ""Bags"" Bags and Cones, of Plastics",1,Imports,gtm,Guatemala,212098
201601,2016-01,7,Chiapas,7392329,"Bags ""Bags"" Bags and Cones, of Plastics",1,Imports,kor,South Korea,119063
201601,2016-01,7,Chiapas,7392690,Plastic Items and Articles of other Materials,1,Imports,gtm,Guatemala,125856
201601,2016-01,7,Chiapas,7392690,Plastic Items and Articles of other Materials,1,Imports,usa,United States,36613
201601,2016-01,7,Chiapas,9441520,"Pallets, Box Pallets and other Load of Wood; Pallet Collars of Wood (Excl. Containers Specially Designed and Equipped for one or more Modes of Transport)",1,Imports,gtm,Guatemala,188875
201601,2016-01,7,Chiapas,10480810,Corrugated Paper and Paperboard,1,Imports,gtm,Guatemala,1454
201601,2016-01,7,Chiapas,10481141,"Paper and Paperboard, Self-Adhesive, Colored or Surface-Decorated or Printed, in Coils ""Rolls"" or Sheets of Square or Rectangular, of any Size (Excl. Articles of Heading 4810)",1,Imports,gtm,Guatemala,1213
201601,2016-01,7,Chiapas,10481820,"Handkerchiefs, Cleansing or Facial Tissues and Towels, of Paper Pulp, Paper, Cellulose Wadding or Webs of Cellulose Fibers",1,Imports,col,Colombia,2284
201601,2016-01,7,Chiapas,10481820,"Handkerchiefs, Cleansing or Facial Tissues and Towels, of Paper Pulp, Paper, Cellulose Wadding or Webs of Cellulose Fibers",1,Imports,gtm,Guatemala,122
201601,2016-01,7,Chiapas,10481820,"Handkerchiefs, Cleansing or Facial Tissues and Towels, of Paper Pulp, Paper, Cellulose Wadding or Webs of Cellulose Fibers",1,Imports,slv,El Salvador,7670
201601,2016-01,7,Chiapas,10481910,Boxes Corrugated Paperboard,1,Imports,gtm,Guatemala,619599
201601,2016-01,7,Chiapas,10482110,"Labels of all Kinds, Paper or Paperboard, Printed",1,Imports,cri,Costa Rica,320
201601,2016-01,7,Chiapas,10482110,"Labels of all Kinds, Paper or Paperboard, Printed",1,Imports,gtm,Guatemala,57742
201601,2016-01,7,Chiapas,10482190,"Labels of all Kinds, Paper or Cardboard, Unprinted",1,Imports,gtm,Guatemala,86
201601,2016-01,7,Chiapas,10482390,"Paper, Cardboard, Cellulose Wadding and Cellulose Fiber Nappa, in Strips or in Rolls of Width <= 36 Cm or in Square or Rectangular Sheets in which there is no Side> 36 Cm, Unfolded",1,Imports,gtm,Guatemala,24983
201601,2016-01,7,Chiapas,10482390,"Paper, Cardboard, Cellulose Wadding and Cellulose Fiber Nappa, in Strips or in Rolls of Width <= 36 Cm or in Square or Rectangular Sheets in which there is no Side> 36 Cm, Unfolded",1,Imports,usa,United States,231
201601,2016-01,7,Chiapas,15731700,"Nails, Tacks ""Bedbugs"" Staples, Corrugated or Beveled, and Similar Articles., of Iron or Steel, Incl. with Heads of other Materials (Excl. with Copperhead, as well as Staples in Strips)",1,Imports,chn,China,7555
201601,2016-01,7,Chiapas,2080390,Fresh or Dried Bananas (Banana Excl.),2,Exports,usa,United States,6283089
201601,2016-01,7,Chiapas,7400129,"Natural Rubber, in Primary Forms or in Sheets or Strips (Exc. Smoked Sheets, Technically Specified Rubbers ""Tsnr"" and Natural Rubber Latex, Incl. Prevulcanized)",2,Exports,gtm,Guatemala,142478
