Month ID,Month,State ID,State,HS6 ID,HS6,Flow ID,Flow,Country ID,Country,Trade Value
201602,2016-02,18,Nayarit,2070960,"Fruits of the Genus Capsicum or of the Genus Pimenta, Fresh or Chilled",2,Exports,usa,United States,613595
201602,2016-02,18,Nayarit,2070999,Vegetables Fresh or Chilled Nes,2,Exports,usa,United States,151947
201602,2016-02,18,Nayarit,2080450,"Guava, Mangoes and Mangosteens, Fresh or Dried",2,Exports,can,Canada,86451
201602,2016-02,18,Nayarit,2080450,"Guava, Mangoes and Mangosteens, Fresh or Dried",2,Exports,usa,United States,108326
201602,2016-02,18,Nayarit,2080719,"Melons, Fresh (Exc. Sandías)",2,Exports,usa,United States,189812
