Month ID,Month,State ID,State,HS6 ID,HS6,Flow ID,Flow,Country ID,Country,Trade Value
200804,2008-04,18,Nayarit,7392690,Plastic Items and Articles of other Materials,1,Imports,chn,China,402
200804,2008-04,18,Nayarit,7392690,Plastic Items and Articles of other Materials,1,Imports,jpn,Japan,11
200804,2008-04,18,Nayarit,7392690,Plastic Items and Articles of other Materials,1,Imports,usa,United States,1242
200804,2008-04,18,Nayarit,15732690,Articles of Iron or Steel,1,Imports,usa,United States,1906
200804,2008-04,18,Nayarit,2070960,"Fruits of the Genus Capsicum or of the Genus Pimenta, Fresh or Chilled",2,Exports,usa,United States,1515141
